{
  "name": "yellow-review",
  "displayName": "Yellow Review",
  "version": "3.12.0",
  "description": "One read-only skill: the thermonuclear structural-quality review rubric — code-judo restructurings, spaghetti-condition growth, weak type and module boundaries, misplaced ownership, and evidence-gated file-size threshold crossings (when the requester supplies before/after line counts). Invoke it explicitly by name; it is not applied to ordinary reviews automatically. Reports findings only; never edits the repository. Excludes all of yellow-review's commands, agents, and other skills.",
  "author": {
    "name": "KingInYellows"
  },
  "homepage": "https://github.com/KingInYellows/yellow-plugins#yellow-review",
  "repository": "https://github.com/KingInYellows/yellow-plugins",
  "license": "MIT",
  "keywords": [
    "pr",
    "code-review",
    "graphite"
  ],
  "category": "development",
  "skills": "./cursor/skills"
}
